text,category
"Sök ledig lägenhet i kommunen","boende"
"Information om hur du söker bostad i Helsingborg","boende"
"Regler för andrahandsuthyrning av lägenhet","boende"
"Så fungerar bostadskön för kommunala bostäder","boende"
"Ansök om bostadsbidrag eller hyresstöd","boende"
"Riktlinjer för trygghetsboende","boende"
"Flytta till eller inom Helsingborg – tips och råd","boende"
"Stöd vid hemlöshet och akutboende","boende"
"Bostadsanpassning för personer med funktionsnedsättning","boende"
"Råd vid störningar i boendet","boende"
"Tips för att hitta studentbostad i kommunen","boende"
"Hur du ansöker om bostadsanpassningsbidrag","boende"
"Information om hyreskontrakt och rättigheter","boende"
"Så fungerar bostadsförmedlingen i kommunen","boende"
"Råd för att minska energikostnader i hemmet","boende"

"Ansök om bygglov för att bygga garage","bygglov"
"Bygglov för uterum, altan eller staket","bygglov"
"Ritningar och kontrollplan för bygglov","bygglov"
"Vad kostar ett bygglov i Helsingborg?","bygglov"
"Bygglov för attefallshus och friggebod","bygglov"
"Tidsplan för handläggning av bygglov","bygglov"
"Bygglovsbefriade åtgärder och undantag","bygglov"
"Så fungerar startbesked och slutbesked","bygglov"
"Rivningslov och marklov i kommunen","bygglov"
"Kontakta stadsbyggnadsförvaltningen för bygglovsfrågor","bygglov"
"Bygglov för att installera solpaneler","bygglov"
"Regler för byggnation av pool och altan","bygglov"
"Hur du ansöker om bygglov digitalt","bygglov"
"Bygglov för att bygga garage och förråd","bygglov"
"Information om bygglovsprocessen och tidsramar","bygglov"
"Så överklagar du ett avslaget bygglov","bygglov"
"Bygglov för att bygga en ny carport","bygglov"
"Information om bygglovsavgifter och kostnader","bygglov"

"Hitta stadskarta och karttjänster","kartor"
"Beställ kartunderlag för bygglov","kartor"
"Se detaljplaner och fastighetsgränser i kartan","kartor"
"Ladda ner ortofoto och kartdata","kartor"
"Karttjänst för skolor och förskolor","kartor"
"Interaktiv karta över cykelvägar","kartor"
"Så använder du kommunens GIS-tjänst","kartor"
"Karta över kommunala fastigheter","kartor"
"Kartdata för planerings- och miljöarbete","kartor"
"Felsökning i digitala karttjänster","kartor"
"Interaktiva kartor för naturreservat","kartor"
"Så hittar du fastighetsgränser med GIS","kartor"
"Beställning av kartdata för byggprojekt","kartor"
"Karta över stadens cykelvägar och gångstråk","kartor"
"Digitala karttjänster för planering och miljö","kartor"
"Digitala kartor för stadsplanering","kartor"
"Så använder du kommunens GIS-verktyg","kartor"
"Beställning av ortofoton och höjddata","kartor"
"Karta över stadens kollektivtrafik","kartor"
"Interaktiva kartor för skolor och förskolor","kartor"
"Karta över stadens naturreservat och parker","kartor"
"Så hittar du skolor och förskolor på kartan","kartor"
"Beställning av fastighetskartor och gränser","kartor"
"Interaktiva kartor för stadens utveckling","kartor"
"Digitala kartor för miljö- och klimatdata","kartor"

"Information om detaljplaner och planprocess","stadsplanering"
"Så arbetar kommunen med översiktsplanering","stadsplanering"
"Pågående planprojekt i Helsingborg","stadsplanering"
"Samråd om ny stadsdel i östra delen","stadsplanering"
"Granskning av förslag till ny detaljplan","stadsplanering"
"Delta i samråd om stadens utveckling","stadsplanering"
"Riktlinjer för hållbar stadsutveckling","stadsplanering"
"Stadsbyggnadsvision 2035","stadsplanering"
"Digitalt planregister för Helsingborg","stadsplanering"
"Planbesked och planavgifter","stadsplanering"
"Planerade byggprojekt i stadens centrum","stadsplanering"
"Samrådsmöten för nya detaljplaner","stadsplanering"
"Information om stadens översiktsplan","stadsplanering"
"Så påverkar detaljplaner stadsutvecklingen","stadsplanering"
"Delta i samråd om framtida byggprojekt","stadsplanering"
"Framtidsvisioner för stadens utveckling","stadsplanering"
"Planeringsmöten för nya stadsdelar","stadsplanering"
"Information om stadens byggprojekt","stadsplanering"
"Så påverkar nya detaljplaner invånarna","stadsplanering"
"Delta i samråd om stadens framtid","stadsplanering"
"Samråd om nya byggprojekt i stadens centrum","stadsplanering"
"Information om stadens framtida byggplaner","stadsplanering"
"Så påverkar nya byggprojekt invånarna","stadsplanering"
"Planeringsmöten för hållbar stadsutveckling","stadsplanering"
"Delta i samråd om stadens framtida visioner","stadsplanering"
"Detaljplaner för nya bostadsområden i kommunen","stadsplanering"
"Information om detaljplaner och byggprojekt","stadsplanering"
"Samråd om detaljplaner för bostadsutveckling","stadsplanering"

"Information om vägarbeten och trafikomläggningar","trafik"
"Karta över parkeringsplatser i centrum","trafik"
"Ansök om parkeringstillstånd","trafik"
"Så fungerar kollektivtrafiken i Helsingborg","trafik"
"Cykelvägar och cykelsäkerhet","trafik"
"Rapportera trasig gatubelysning eller skylt","trafik"
"Trafiksäkerhetsarbete i kommunen","trafik"
"Regler för elsparkcyklar i stadskärnan","trafik"
"Planering av nya gång- och cykelbanor","trafik"
"Upphandling av trafikentreprenörer","trafik"
"Trafikplanering för nya bostadsområden","trafik"
"Information om trafikregler och säkerhet","trafik"
"Så rapporterar du trasiga trafikljus","trafik"
"Planerade vägarbeten och omläggningar","trafik"
"Karta över stadens parkeringsplatser","trafik"
"Trafiksäkerhetsåtgärder vid skolor","trafik"
"Information om stadens cykelvägar","trafik"
"Så rapporterar du farliga vägförhållanden","trafik"
"Planerade förbättringar av kollektivtrafiken","trafik"
"Karta över stadens gång- och cykelvägar","trafik"
"Information om trafikflöden i stadens centrum","trafik"
"Så rapporterar du trasiga trafikskyltar","trafik"
"Planerade förbättringar av stadens vägnät","trafik"
"Karta över stadens parkeringshus och avgifter","trafik"
"Trafiksäkerhetsåtgärder vid skolor och förskolor","trafik"
"Digitala kartor för att hitta cykelvägar","kartor"
"Så använder du GIS-tjänster för planering","kartor"
"Beställning av kartdata för byggprojekt","kartor"
"Karta över stadens naturreservat och parker","kartor"
"Interaktiva kartor för stadens utveckling","kartor"
"Samråd om nya byggprojekt i stadens centrum","stadsplanering"
"Information om stadens framtida byggplaner","stadsplanering"
"Så påverkar nya byggprojekt invånarna","stadsplanering"
"Planeringsmöten för hållbar stadsutveckling","stadsplanering"
"Delta i samråd om stadens framtida visioner","stadsplanering"
"Trafikplanering för nya cykelvägar och gångbanor","trafik"
"Information om stadens trafikregler och säkerhet","trafik"
"Så rapporterar du trasiga trafikskyltar","trafik"
"Planerade förbättringar av stadens kollektivtrafik","trafik"
"Karta över stadens parkeringsplatser och avgifter","trafik"
"GIS-tjänster för att planera byggprojekt","kartor"
"Så använder du kartdata för stadsplanering","kartor"
"Beställning av höjddata och ortofoton","kartor"
"Karta över stadens cykelvägar och gångstråk","kartor"
"Interaktiva kartor för skolor och förskolor","kartor"
"Framtidsvisioner för stadens utveckling","stadsplanering"
"Planeringsmöten för nya stadsdelar","stadsplanering"
"Information om stadens byggprojekt","stadsplanering"
"Så påverkar nya detaljplaner invånarna","stadsplanering"
"Delta i samråd om stadens framtid","stadsplanering"
"Trafiksäkerhetsåtgärder vid skolor","trafik"
"Information om stadens cykelvägar","trafik"
"Så rapporterar du farliga vägförhållanden","trafik"
"Planerade förbättringar av kollektivtrafiken","trafik"
"Karta över stadens gång- och cykelvägar","trafik"
"Digitala kartor för stadsplanering","kartor"
"Så använder du kommunens GIS-verktyg","kartor"
"Beställning av ortofoton och höjddata","kartor"
"Karta över stadens kollektivtrafik","kartor"
"Interaktiva kartor för skolor och förskolor","kartor"
"Planerade byggprojekt i stadens centrum","stadsplanering"
"Samrådsmöten för nya detaljplaner","stadsplanering"
"Information om stadens översiktsplan","stadsplanering"
"Så påverkar detaljplaner stadsutvecklingen","stadsplanering"
"Delta i samråd om framtida byggprojekt","stadsplanering"
"Trafikplanering för nya bostadsområden","trafik"
"Information om trafikregler och säkerhet","trafik"
"Så rapporterar du trasiga trafikljus","trafik"
"Planerade vägarbeten och omläggningar","trafik"
"Karta över stadens parkeringsplatser","trafik"
"Information om återvinningsstationer i kommunen","miljö"
"Så sorterar du ditt hushållsavfall korrekt","miljö"
"Hitta närmaste återvinningscentral","miljö"
"Regler för återvinning av elektronik","miljö"
"Tips för att minska avfall i hemmet","miljö"
"Hur ansöker jag om ekonomiskt stöd från kommunen?","stöd & hjälp"
"Information om bidrag och ekonomiskt bistånd","stöd & hjälp"
"Riktlinjer för ekonomiskt stöd till familjer","stöd & hjälp"
"Ansök om ekonomiskt stöd vid krissituationer","stöd & hjälp"
"Ekonomiskt bistånd för boendekostnader","stöd & hjälp"
"Rapportera trasiga gatlyktor i kommunen","trafik"
"Anmäl trasiga trafikljus och skyltar","trafik"
"Information om gatubelysning och underhåll","infrastruktur"
"Bidrag för installation av solpaneler","hållbarhet"
"Stöd för energieffektivisering i hemmet","hållbarhet"
"Information om detaljplaner och byggprojekt","stadsplanering"
"Så hittar du detaljplaner i kommunen","stadsplanering"
"Delta i samråd om nya detaljplaner","stadsplanering"
"Stöd för grön energi och solpaneler","hållbarhet"
"Bidrag för hållbara energilösningar","hållbarhet"
"Information om energieffektivisering i kommunen","hållbarhet"
"Ansök om stöd för hållbar energiutveckling","hållbarhet"
"Kommunens arbete med grön energiomställning","hållbarhet"
"Ansök om stöd för laddstationer till elbilar","hållbarhet"
"Information om bidrag för elbilar och laddinfrastruktur","hållbarhet"
"Kommunens arbete med elbilsomställning","hållbarhet"
"Stöd för hållbara transporter och elbilar","hållbarhet"
"Bidrag för laddstationer i bostadsområden","hållbarhet"
"Ansök om bidrag för elbilar och laddstationer","hållbarhet"
"Kommunens stöd för elbilsinfrastruktur","hållbarhet"
"Hållbara transporter: elbilar och laddstationer","hållbarhet"
"Information om elbilsbidrag och hållbarhet","hållbarhet"
"Stöd för grön transport och elfordon","hållbarhet"
"Bidrag för elbilar och hållbara transporter","hållbarhet"
"Kommunens hållbarhetsprogram för elfordon","hållbarhet"
"Ansök om stöd för grön energi och elbilar","hållbarhet"
"Information om hållbara transportlösningar","hållbarhet"
"Stöd för elbilar under hållbarhetsinitiativ","hållbarhet"
"Återvinningsstationer är öppna alla dagar i veckan.","miljö"
"Återvinningsstationer är öppna alla dagar i veckan.","stöd & hjälp"
"Information om återvinning och avfallshantering.","miljö"
"Information om återvinning och avfallshantering.","hållbarhet"
"Hur du sorterar ditt avfall korrekt.","miljö"
"Hur du sorterar ditt avfall korrekt.","hållbarhet"
"Plaståtervinning och miljöpåverkan.","miljö"
"Plaståtervinning och miljöpåverkan.","hållbarhet"
"Kommunens arbete för att minska avfall.","miljö"
"Kommunens arbete för att minska avfall.","hållbarhet"
"Hur fungerar återvinningsstationer i kommunen?","miljö"
"Hur fungerar återvinningsstationer i kommunen?","hållbarhet"